{
  "$schema": "https://json-schema.org/draft/2020-12/schema",
  "$id": "https://unitaryfoundation.github.io/clifft-bench/schemas/run-v1.schema.json",
  "title": "clifft-bench run manifest v1",
  "type": "object",
  "additionalProperties": false,
  "required": [
    "schema_version", "suite_version", "profile_id", "classification", "seed",
    "workloads_manifest", "software_manifest", "resources", "measurement"
  ],
  "properties": {
    "schema_version": {"const": "clifft-bench/run/v1"},
    "suite_version": {"type": "string", "pattern": "^[0-9]+\\.[0-9]+\\.[0-9]+$"},
    "profile_id": {"type": "string", "pattern": "^[a-z0-9][a-z0-9._-]+$"},
    "title": {"type": "string", "minLength": 1},
    "classification": {"enum": ["smoke", "official"]},
    "seed": {"type": "integer", "minimum": 1},
    "workloads_manifest": {"type": "string", "minLength": 1},
    "software_manifest": {"type": "string", "minLength": 1},
    "hardware_epoch": {"type": "string", "pattern": "^[a-z0-9][a-z0-9._-]+$"},
    "reference_host": {
      "type": "object",
      "additionalProperties": false,
      "required": ["provider", "instance_type", "architecture", "os_id", "os_version"],
      "properties": {
        "provider": {"type": "string", "minLength": 1},
        "instance_type": {"type": "string", "minLength": 1},
        "architecture": {"type": "string", "minLength": 1},
        "os_id": {"type": "string", "minLength": 1},
        "os_version": {"type": "string", "minLength": 1}
      }
    },
    "collection": {
      "type": "object",
      "additionalProperties": false,
      "required": [
        "placements", "replicas_per_placement", "run_timeout_minutes", "memory_limit_gib"
      ],
      "properties": {
        "placements": {"type": "integer", "minimum": 1},
        "replicas_per_placement": {"type": "integer", "minimum": 1},
        "run_timeout_minutes": {"type": "integer", "minimum": 1},
        "memory_limit_gib": {"type": "number", "exclusiveMinimum": 0}
      }
    },
    "comparisons": {
      "type": "array",
      "items": {
        "type": "object",
        "additionalProperties": false,
        "required": ["id", "baseline_variant", "candidate_variants"],
        "properties": {
          "id": {"type": "string", "pattern": "^[a-z0-9][a-z0-9._-]+$"},
          "baseline_variant": {"type": "string", "minLength": 1},
          "candidate_variants": {
            "type": "array", "minItems": 1, "uniqueItems": true,
            "items": {"type": "string", "minLength": 1}
          }
        }
      }
    },
    "resources": {
      "type": "object",
      "additionalProperties": false,
      "required": ["logical_cpu"],
      "properties": {
        "logical_cpu": {"type": ["integer", "null"], "minimum": 0}
      }
    },
    "measurement": {
      "type": "object",
      "additionalProperties": false,
      "required": [
        "setup_timeout_seconds", "request_timeout_seconds", "warmup_shots", "correctness_shots",
        "min_sample_seconds", "repetitions"
      ],
      "properties": {
        "setup_timeout_seconds": {"type": "number", "exclusiveMinimum": 0},
        "request_timeout_seconds": {"type": "number", "exclusiveMinimum": 0},
        "warmup_shots": {"type": "integer", "minimum": 1},
        "correctness_shots": {"type": "integer", "minimum": 1},
        "min_sample_seconds": {"type": "number", "exclusiveMinimum": 0},
        "repetitions": {"type": "integer", "minimum": 1}
      }
    },
    "cases": {
      "type": "array",
      "minItems": 1,
      "items": {"$ref": "#/$defs/case"}
    },
    "variants": {
      "type": "array",
      "minItems": 1,
      "items": {
        "type": "object",
        "additionalProperties": false,
        "required": ["id", "implementation_id", "execution", "workloads"],
        "properties": {
          "id": {"type": "string", "pattern": "^[a-z0-9][a-z0-9._-]+$"},
          "implementation_id": {"type": "string", "minLength": 1},
          "execution": {"$ref": "#/$defs/execution"},
          "workloads": {
            "type": "array",
            "minItems": 1,
            "items": {"$ref": "#/$defs/workloadSelection"}
          }
        }
      }
    }
  },
  "$defs": {
    "clifftScheduler": {
      "type": "object",
      "additionalProperties": false,
      "required": ["beam_width", "search_budget", "noise_transparent", "sink_neutral_rotations"],
      "properties": {
        "beam_width": {"type": "integer", "minimum": 1},
        "search_budget": {"type": ["number", "null"], "minimum": 0},
        "noise_transparent": {"type": "boolean"},
        "sink_neutral_rotations": {"type": "boolean"}
      }
    },
    "execution": {
      "type": "object",
      "additionalProperties": false,
      "required": ["mode", "batch_enabled", "batch_size", "sample_chunk_shots"],
      "properties": {
        "mode": {"enum": ["latency", "throughput"]},
        "batch_enabled": {"type": "boolean"},
        "batch_size": {
          "oneOf": [
            {"type": "integer", "minimum": 1},
            {"const": "calibrate"}
          ]
        },
        "sample_chunk_shots": {"type": "integer", "minimum": 0},
        "clifft_scheduler": {"$ref": "#/$defs/clifftScheduler"},
        "tsim_trajectory_sharing": {"type": "boolean"}
      }
    },
    "workloadSelection": {
      "type": "object",
      "additionalProperties": false,
      "required": ["workload_id", "shots_per_call"],
      "properties": {
        "workload_id": {"type": "string", "minLength": 1},
        "shots_per_call": {"type": "integer", "minimum": 1}
      }
    },
    "case": {
      "type": "object",
      "additionalProperties": false,
      "required": [
        "id", "variant_id", "workload_id", "implementation_id", "shots_per_call", "execution"
      ],
      "properties": {
        "id": {"type": "string", "pattern": "^[a-z0-9][a-z0-9._-]+$"},
        "variant_id": {"type": "string", "pattern": "^[a-z0-9][a-z0-9._-]+$"},
        "workload_id": {"type": "string", "minLength": 1},
        "implementation_id": {"type": "string", "minLength": 1},
        "shots_per_call": {"type": "integer", "minimum": 1},
        "execution": {"$ref": "#/$defs/execution"}
      }
    }
  },
  "allOf": [
    {
      "oneOf": [
        {"required": ["cases"], "not": {"required": ["variants"]}},
        {"required": ["variants"], "not": {"required": ["cases"]}}
      ]
    },
    {
      "if": {"properties": {"classification": {"const": "official"}}},
      "then": {
        "required": [
          "title", "hardware_epoch", "reference_host", "collection", "comparisons", "variants"
        ]
      }
    }
  ]
}
